{
  "schema_version": 1,
  "preset": "complex",
  "current": {
    "task": "只读区 + 判据完整性兜底",
    "next": "eval 自循环（--loop）",
    "iteration": "v0.1.3",
    "stage": "testing"
  },
  "blocked": [
    {
      "what": "Codex PreToolUse deny 未证实",
      "unblock": "Codex 额度恢复后用隔离环境补测",
      "since": "2026-07-12"
    },
    {
      "what": "Codex PostToolUse 协议未实测",
      "unblock": "额度恢复后实测，不凭印象写",
      "since": "2026-07-12"
    }
  ],
  "pending_user": [],
  "recent_decisions": [
    {
      "decision": "判据仓对 AI 只读",
      "why": "改判据比改代码容易",
      "date": "2026-07-12"
    },
    {
      "decision": "开发用 --plugin-dir 跑 dev",
      "why": "in-place 加载，零污染",
      "date": "2026-07-12"
    },
    {
      "decision": "PostToolUse 用顶层 decision",
      "why": "该字段是 PreToolUse 专用",
      "date": "2026-07-12"
    }
  ],
  "session": {
    "last": 2,
    "last_date": "2026-07-12",
    "log_written": true
  },
  "updated_at": "2026-07-12T14:18:08+00:00"
}
